{
  "acceptance_checks": [
    "One new Migration is registered with destructive=False and an apply honouring dry_run.",
    "A task lacking the key gains []; a prefix-shaped value becomes []; an id-shaped value and an already-empty value are untouched.",
    "A non-canonically serialized fixture keeps its byte layout except for the inserted key.",
    "No key other than cca_checklist_profile changes value in any file.",
    "The migration is idempotent: a second run produces no diff.",
    "dry_run=True writes nothing.",
    "No file under .shiki/ is changed by this task.",
    "tests/test_checklist_profile_migration.py runs over a temporary fixture tree, never the real mirror.",
    "No file outside the declared locks is changed."
  ],
  "assigned_runtime": "claude-code",
  "dependencies": [],
  "expected_branch": "shiki/t-20260801t041653423255z-2798773b-register-the-cca-checklist-profile-backfill-as-a",
  "expected_pr": null,
  "github_issue": null,
  "goal_id": "G-20260801T041653421243Z-2d98487f",
  "id": "T-20260801T041653423255Z-2798773b",
  "ledger_evidence": [
    "L-20260801T041653423278Z-94b97e17"
  ],
  "locks": [
    "path:scripts/shiki_migrations.py",
    "path:tests/test_checklist_profile_migration.py"
  ],
  "non_goals": [
    "Applying the migration to this repository's mirror",
    "Changing any file under .shiki/",
    "Choosing a non-empty default for any task",
    "Reserializing or reordering keys in any task file",
    "Touching any file outside the declared locks"
  ],
  "required_skills": [
    "tdd",
    "code-review"
  ],
  "risk_level": "medium",
  "scope": "Register one new `Migration` in `scripts/shiki_migrations.py`'s registry, following the shape of the existing entries (`id`, `title`, `description`, `introduced_in`, `requires`, `affected_paths`, `destructive=False`, `apply`). Its `apply` walks every file in `.shiki/tasks/`, and:\n  - adds `\"cca_checklist_profile\": []` to any task lacking the key;\n  - replaces any value whose entries are bare family names \u2014 no `-` and no digits, e.g. `['PR','TDD','V','CCA']` \u2014 with `[]`;\n  - leaves an id-shaped value (a family prefix, `-`, digits: `CCA-08`, `PR-01`, `V-04`) untouched;\n  - changes nothing else in any file.\n\nIt must edit in place and preserve each file's existing byte layout everywhere it does not write. This is a measured hazard: 14 of the 112 task files are not canonically serialized, so a `json.dumps(..., indent=2, sort_keys=True)` round-trip rewrites files the migration never intended to touch. Insert the key positionally in the existing text \u2014 the established safe point is directly after `assigned_runtime`, with no key reordering between it and `cca_checklist_profile` \u2014 rather than reserializing. Honour the `dry_run` flag the `apply` signature already carries.\n\nThis task does NOT apply the migration to this repository's mirror and does not change any file under `.shiki/`. It only registers the function.\n\nAdd `tests/test_checklist_profile_migration.py` running the migration over a temporary fixture tree, not over the real mirror: a task lacking the key gains `[]`; a prefix-shaped value becomes `[]`; an id-shaped value is untouched; an already-`[]` value is untouched; a non-canonically serialized file (unsorted keys, no trailing newline) keeps its layout except for the inserted key; no other key's value changes anywhere; running it twice produces no second diff; `dry_run=True` writes nothing.\n\nREPRODUCIBILITY \u2014 what this task removes, and what to change to get the same result.\n  Symptom: `cca_checklist_profile` cannot be promoted to a required field because 104 of 112 task files do not carry it, and 8 carry a value the gate cannot match.\n  Measured 2026-08-01 by driving the real reader: `checklist_profile_coverage_failures(task, verdict)` against a verdict in which every checklist item passes returns four blocking reasons for `['PR','TDD','V','CCA']` \u2014 'CCA checklist profile id PR is missing from the verdict checklist', and likewise for TDD, V and CCA \u2014 and returns `[]` for `[]` and for `['CCA-08']`. So the prefix form blocks a fully passing verdict and expresses nothing anyone intended. One of the 8 is LIVE at status=review (T-20260613T095433721787Z-8d6b04d5) and is unmergeable today for this reason.\n  Formatting landmine, measured: 14 of 112 task files differ from `json.dumps(data, indent=2, sort_keys=True) + '\\n'`. Reserializing churns them, and the diff then no longer equals a minimal expectation \u2014 which, once the migration mode judges by exact equality, is not merely ugly but a blocking mismatch.\n  Exact change that reproduces this result: an in-place migration that inserts the key after `assigned_runtime` and rewrites only bare-family values.\n  Reproducible when: the migration is idempotent over a fixture tree and leaves non-canonical files byte-identical apart from the inserted key.",
  "status": "planned",
  "test_command": "python3 -m unittest discover -s tests && python3 scripts/validate_shiki.py --target .",
  "title": "Register the cca_checklist_profile backfill as a migration"
}
