{
  "id": "T-0009",
  "goal_id": "G-0001",
  "github_issue": null,
  "title": "Add daemon, runner, live smoke, and GitHub orchestrator automation",
  "scope": "Implement the remaining automation layer so users can queue grill-with-docs plans for background processing, run headless task commands with ledger evidence, smoke-test a real GitHub-backed target, and trigger Shiki orchestration from GitHub Actions.",
  "non_goals": [
    "Do not bypass branch protection.",
    "Do not create real GitHub issues or PRs in local tests.",
    "Do not require non-standard Python dependencies.",
    "Do not hard-code Codex or Hermes as the only runner runtime."
  ],
  "dependencies": [
    "T-0008"
  ],
  "locks": [
    "path:scripts/shiki.py",
    "path:scripts/validate_shiki.py",
    "path:scripts/test_shiki_daemon_runner.sh",
    "path:.github/workflows/shiki-validate.yml",
    "path:.github/workflows/shiki-orchestrator.yml",
    "path:.claude/commands/shiki.md",
    "path:.codex/skills/shiki/SKILL.md",
    "path:docs/agents/bootstrap-command.md",
    "path:docs/agents/control-commands.md",
    "path:.shiki/schemas/inbox.schema.json",
    "path:.shiki/schemas/runner-record.schema.json",
    "path:.shiki/schemas/smoke.schema.json",
    "path:.shiki/tasks/T-0008.json",
    "path:.shiki/tasks/T-0009.json",
    "path:.shiki/ledger/L-0011.json",
    "path:.shiki/ledger/L-0012.json",
    "path:.shiki/ledger/L-0013.json",
    "path:.shiki/ledger/L-0015.json"
  ],
  "assigned_runtime": "codex-front",
  "risk_level": "medium",
  "required_skills": [
    "shiki",
    "tdd"
  ],
  "acceptance_checks": [
    "python3 scripts/validate_shiki.py",
    "python3 -m py_compile scripts/shiki.py scripts/validate_shiki.py",
    "bash scripts/test_shiki_init.sh",
    "bash scripts/test_shiki_control_plane.sh",
    "bash scripts/test_shiki_run_orchestrator.sh",
    "bash scripts/test_shiki_daemon_runner.sh",
    "Validate Shiki mirror runs daemon and runner contract tests in CI.",
    "PR evidence includes CCA and MergeGate success."
  ],
  "expected_branch": "shiki-daemon-runner-automation",
  "expected_pr": 16,
  "ledger_evidence": [
    "L-0011",
    "L-0013",
    "L-0015"
  ],
  "status": "done"
}
