{
  "acceptance_checks": [
    "decide_task_action routes merged-impl->create_closeout_pr and merged-closeout->mark_done; the effector repoints expected_pr on the branch, is fail-closed, and never raises.",
    "python3 -m unittest discover -s tests + all scripts/test_shiki_*.sh (incl goal_loop.sh full self-drive) + validate_shiki are green.",
    "Live: shiki loop run on a low-risk task self-drives to auto-merge AND goal-complete on main with zero manual intervention."
  ],
  "assigned_runtime": "claude-code",
  "dependencies": [],
  "expected_branch": "shiki/loop-gapb-autonomous-closeout",
  "expected_pr": 155,
  "github_issue": null,
  "goal_id": "G-20260618T062311037333Z-0c9a58e7",
  "id": "T-20260618T062324783813Z-f62d375b",
  "ledger_evidence": [
    "L-20260618T062311038122Z-950d2e51",
    "L-20260618T062324784100Z-6c5138c8",
    "L-20260618T063113496734Z-c86e0fc1",
    "L-20260618T063113497087Z-ee536865",
    "L-20260618T063113497198Z-1ee7b48d",
    "L-20260618T063113497293Z-a8e4aaaa",
    "L-20260618T063113497366Z-ee7f03aa",
    "L-20260618T063238751486Z-db545081"
  ],
  "locks": [
    "path:scripts/shiki_loop.py",
    "path:tests/test_loop_engine.py",
    "path:tests/test_loop_branch_plumbing.py",
    "path:scripts/test_shiki_goal_loop.sh",
    "path:docs/adr/0012-autonomous-loop-closeout-to-main.md",
    "path:.shiki/goals/G-20260618T062311037333Z-0c9a58e7.json",
    "path:.shiki/dag/G-20260618T062311037333Z-0c9a58e7.json",
    "path:.shiki/tasks/T-20260618T062324783813Z-f62d375b.json",
    "path:.shiki/locks/T-20260618T062324783813Z-f62d375b.json",
    "path:.shiki/ledger/L-20260618T062311038122Z-950d2e51.json",
    "path:.shiki/ledger/L-20260618T062324784100Z-6c5138c8.json",
    "path:.shiki/ledger/L-20260618T063113496734Z-c86e0fc1.json",
    "path:.shiki/ledger/L-20260618T063113497087Z-ee536865.json",
    "path:.shiki/ledger/L-20260618T063113497198Z-1ee7b48d.json",
    "path:.shiki/ledger/L-20260618T063113497293Z-a8e4aaaa.json",
    "path:.shiki/ledger/L-20260618T063113497366Z-ee7f03aa.json",
    "path:.shiki/ledger/L-20260618T063238751486Z-db545081.json"
  ],
  "non_goals": [
    "Multi-task closeout sequencing (deferred per ADR 0012).",
    "No force-push / branch deletion."
  ],
  "required_skills": [
    "grill-with-docs",
    "diagnose",
    "tdd",
    "code-review"
  ],
  "risk_level": "high",
  "scope": "Add create_closeout_pr/closeout-phase logic to decide_task_action (+ ACTION_PRIORITY); the merge action no longer marks done; goal_complete syncs the coordinator from origin/main without re-running cmd_goal_complete. New _create_closeout_pr effector: worktree from origin/main, set task=done + lock=released + cmd_goal_complete (iff it completes the goal), repoint expected_pr on the branch, /pull self-ref ledger, fail-closed + never-raises, stop_blocked on an interrupted-run PR. ADR 0012. Tests: decision cases, effector integration, goal_loop.sh full self-drive.",
  "status": "review",
  "test_command": "python3 -m unittest discover -s tests",
  "title": "Automate the post-merge closeout PR in the goal loop (ADR 0012)"
}