{
  "acceptance_checks": [
    "shiki doctor --json --online --target . reports doctor.provider.repo_json status pass",
    "shiki doctor --json --online --target . evaluates doctor.github.branch_protection instead of reporting doctor.github.online skip",
    "python3 scripts/validate_shiki.py passes"
  ],
  "assigned_runtime": "claude-code",
  "dependencies": [],
  "expected_branch": "claude/compassionate-lalande-acfec7",
  "expected_pr": 354,
  "github_issue": null,
  "goal_id": "G-20260824T033043243224Z-7bbcdbce",
  "id": "T-20260824T033055633960Z-c332534d",
  "ledger_evidence": [
    "L-20260824T033043243824Z-d1cdb0ba",
    "L-20260824T033055634152Z-3ed24cdb",
    "L-20260824T033355111913Z-b3cd057f",
    "L-20260824T033620118432Z-c375c512",
    "L-20260824T033532010485Z-b57c8703",
    "L-20260824T034812445901Z-9f5c93ac"
  ],
  "locks": [
    "path:.shiki/repo.json"
  ],
  "non_goals": [
    "Do not change GitHub branch protection.",
    "Do not change doctor's config-reading logic or any script under scripts/."
  ],
  "required_skills": [
    "code-review"
  ],
  "risk_level": "low",
  "scope": "Add .shiki/repo.json for mizutani-140/shiki, generated by shiki_bootstrap.write_target_repo_config so it is byte-identical to what shiki init would write, making doctor's online GitHub checks reachable on the platform repository.",
  "status": "review",
  "test_command": "python3 -m unittest discover -s tests",
  "title": "Record platform provider metadata in .shiki/repo.json so doctor's online checks run"
}
